id,submitter,authors,title,comments,journal-ref,doi,report-no,categories,license,abstract,versions,update_date,authors_parsed
2203.06914,Boon Kiat Oh,"Boon Kiat Oh, Hongjun An, Eun-jin Shin, Ji-hoon Kim and Sungwook E.
  Hong",Machine-guided Exploration and Calibration of Astrophysical Simulations,,,,,astro-ph.GA,http://creativecommons.org/licenses/by/4.0/,"  We apply a novel method with machine learning to calibrate sub-grid models
within numerical simulation codes to achieve convergence with observations and
between different codes. It utilizes active learning and neural density
estimators. The hyper parameters of the machine are calibrated with a
well-defined projectile motion problem. Then, using a set of 22 cosmological
zoom simulations, we tune the parameters of a popular star formation and
feedback model within Enzo to match simulations. The parameters that are
adjusted include the star formation efficiency, coupling of thermal energy from
stellar feedback, and volume into which the energy is deposited. This number
translates to a factor of more than three improvements over manual calibration.
Despite using fewer simulations, we obtain a better agreement to the observed
baryon makeup of a Milky-Way (MW) sized halo. Switching to a different
strategy, we improve the consistency of the recommended parameters from the
machine. Given the success of the calibration, we then apply the technique to
reconcile metal transport between grid-based and particle-based simulation
codes using an isolated galaxy. It is an improvement over manual exploration
while hinting at a less known relation between the diffusion coefficient and
the metal mass in the halo region. The exploration and calibration of the
parameters of the sub-grid models with a machine learning approach is concluded
to be versatile and directly applicable to different problems.
","[{'version': 'v1', 'created': 'Mon, 14 Mar 2022 08:07:21 GMT'}]",2022-03-15,"[['Oh', 'Boon Kiat', ''], ['An', 'Hongjun', ''], ['Shin', 'Eun-jin', ''], ['Kim', 'Ji-hoon', ''], ['Hong', 'Sungwook E.', '']]"
2012.08849,Andres Pinilla,"Andres Pinilla, Jaime Garcia, William Raffe, Jan-Niklas Voigt-Antons,
  Robert Spang, Sebastian M\""oller",Affective visualization in Virtual Reality: An integrative review,,,,,cs.HC,http://creativecommons.org/licenses/by/4.0/,"  A cluster of research in Affective Computing suggests that it is possible to
infer some characteristics of users' affective states by analyzing their
electrophysiological activity in real-time. However, it is not clear how to use
the information extracted from electrophysiological signals to create visual
representations of the affective states of Virtual Reality (VR) users.
Visualization of users' affective states in VR can lead to biofeedback
therapies for mental health care. Understanding how to visualize affective
states in VR requires an interdisciplinary approach that integrates psychology,
electrophysiology, and audio-visual design. Therefore, this review aims to
integrate previous studies from these fields to understand how to develop
virtual environments that can automatically create visual representations of
users' affective states. The manuscript addresses this challenge in four
sections: First, theories related to emotion and affect are summarized. Second,
evidence suggesting that visual and sound cues tend to be associated with
affective states are discussed. Third, some of the available methods for
assessing affect are described. The fourth and final section contains five
practical considerations for the development of virtual reality environments
for affect visualization.
","[{'version': 'v1', 'created': 'Wed, 16 Dec 2020 10:42:40 GMT'}, {'version': 'v2', 'created': 'Sun, 4 Jul 2021 09:01:24 GMT'}]",2021-07-06,"[['Pinilla', 'Andres', ''], ['Garcia', 'Jaime', ''], ['Raffe', 'William', ''], ['Voigt-Antons', 'Jan-Niklas', ''], ['Spang', 'Robert', ''], ['Möller', 'Sebastian', '']]"
2107.02932,Alireza Shirmarz Dr,Alireza Shirmarz,"Towards Network Behaviour Trend Evaluation in Software Defined Network
  (SDN) Considering the number of paths","6 pages, 2 Tables and 1 figure",,,,cs.NI,http://creativecommons.org/licenses/by/4.0/,"  There is a wide range of topologies to use in simulation that can make
research divergency; therefore, we propose a topology set that can be used in
research of network behaviour in Software Defined Network (SDN). This paper can
unite the trend research that is doing in different aspects of SDN. One of the
most effective items which show the behaviour of the proposed model in SDN is
the number of paths that exist between each couple of nodes; hence, we propose
three basic topologies to show this parameter. This paper is useful for those
who are working on SDN and intend to evaluate the effect of their proposal
considering the number of paths. Finally, three topologies called sparse,
partial-mesh and full-mesh will be introduced in this paper.
","[{'version': 'v1', 'created': 'Tue, 6 Jul 2021 23:12:18 GMT'}]",2021-07-08,"[['Shirmarz', 'Alireza', '']]"
1612.03730,Robert J. Nemiroff,"Robert Nemiroff, Eva Nemiroff",Dreidel Fairness Study,"6 pages, 1 figure, 1 table, v2: 2 minor typos corrected, a serious
  study with a few humorous commments",,,,physics.pop-ph,http://creativecommons.org/licenses/by/4.0/,"  Are dreidels fair? In other words, does the average dreidel have an equal
chance of turning up any one of its four sides? To explore this hypothesis,
three different dreidels were each spun hundreds of times with the number of
occurrences of each side recorded. It was found that all three dreidels tested
-- a cheap plastic dreidel, an old wooden dreidel, and a dreidel that came
embossed with a picture of Santa Claus -- were not fair. Statistically, for
each dreidel, some sides came up significantly more often than others. Although
an unfair dreidel does not necessarily make the game itself unfair, it is
conjectured that hundreds of pounds of chocolate have been distributed during
Chanukah under false pretenses.
","[{'version': 'v1', 'created': 'Mon, 28 Nov 2016 18:28:43 GMT'}, {'version': 'v2', 'created': 'Wed, 14 Dec 2016 18:33:06 GMT'}]",2016-12-15,"[['Nemiroff', 'Robert', ''], ['Nemiroff', 'Eva', '']]"
1805.04570,Chaitanya Malaviya,"Chaitanya Malaviya, Matthew R. Gormley, Graham Neubig",Neural Factor Graph Models for Cross-lingual Morphological Tagging,Proceedings of ACL 2018,,,,cs.CL,http://creativecommons.org/licenses/by/4.0/,"  Morphological analysis involves predicting the syntactic traits of a word
(e.g. {POS: Noun, Case: Acc, Gender: Fem}). Previous work in morphological
tagging improves performance for low-resource languages (LRLs) through
cross-lingual training with a high-resource language (HRL) from the same
family, but is limited by the strict, often false, assumption that tag sets
exactly overlap between the HRL and LRL. In this paper we propose a method for
cross-lingual morphological tagging that aims to improve information sharing
between languages by relaxing this assumption. The proposed model uses
factorial conditional random fields with neural network potentials, making it
possible to (1) utilize the expressive power of neural network representations
to smooth over superficial differences in the surface forms, (2) model pairwise
and transitive relationships between tags, and (3) accurately generate tag sets
that are unseen or rare in the training data. Experiments on four languages
from the Universal Dependencies Treebank demonstrate superior tagging
accuracies over existing cross-lingual approaches.
","[{'version': 'v1', 'created': 'Fri, 11 May 2018 19:27:07 GMT'}, {'version': 'v2', 'created': 'Sun, 10 Jun 2018 01:47:13 GMT'}, {'version': 'v3', 'created': 'Wed, 11 Jul 2018 03:04:44 GMT'}]",2018-07-12,"[['Malaviya', 'Chaitanya', ''], ['Gormley', 'Matthew R.', ''], ['Neubig', 'Graham', '']]"
2103.16551,Anubhav Guha,Anubhav Guha and Anuradha Annaswamy,Online Policies for Real-Time Control Using MRAC-RL,Submitted to CDC 2021,,,,eess.SY cs.SY,http://creativecommons.org/licenses/by/4.0/,"  In this paper, we propose the Model Reference Adaptive Control &
Reinforcement Learning (MRAC-RL) approach to developing online policies for
systems in which modeling errors occur in real-time. Although reinforcement
learning (RL) algorithms have been successfully used to develop control
policies for dynamical systems, discrepancies between simulated dynamics and
the true target dynamics can cause trained policies to fail to generalize and
adapt appropriately when deployed in the real-world. The MRAC-RL framework
generates online policies by utilizing an inner-loop adaptive controller
together with a simulation-trained outer-loop RL policy. This structure allows
MRAC-RL to adapt and operate effectively in a target environment, even when
parametric uncertainties exists. We propose a set of novel MRAC algorithms,
apply them to a class of nonlinear systems, derive the associated control laws,
provide stability guarantees for the resulting closed-loop system, and show
that the adaptive tracking objective is achieved. Using a simulation study of
an automated quadrotor landing task, we demonstrate that the MRAC-RL approach
improves upon state-of-the-art RL algorithms and techniques through the
generation of online policies.
","[{'version': 'v1', 'created': 'Tue, 30 Mar 2021 17:56:59 GMT'}]",2021-10-20,"[['Guha', 'Anubhav', ''], ['Annaswamy', 'Anuradha', '']]"
2104.10812,Lili Miao,"Lili Miao, Dakota Murray, Woo-Sung Jung, Vincent Larivi\`ere, Cassidy
  R. Sugimoto, Yong-Yeol Ahn",The latent structure of national scientific development,"30 pages(main text), 45 pages total. 5 figures(main text), 9
  figures(supporting information). 2 tables(main text), 4 tables(supporting
  information)",,,,cs.SI,http://creativecommons.org/licenses/by/4.0/,"  Science is considered essential to innovation and economic prosperity.
Understanding how nations build scientific capacity is therefore crucial to
promote economic growth and national development. Although studies have shown
that national scientific development is affected by geographic, historic, and
economic factors, it remains unclear whether there are universal structures and
trajectories behind national scientific development that can inform forecasting
and policy making. By examining countries' scientific exportation-the
publications that are internationally indexed-we reveal a three-cluster
structure in the relatedness network of disciplines that underpin national
scientific development and the organization of global science. Tracing the
evolution of national research portfolios reveals that while nations are
proceeding to more diverse research profiles individually, scientific
production is increasingly specialized in global science over the past decades.
We further demonstrate that the revealed disciplinary clusters inform economic
development, where the number of publications in applied research centered
cluster significantly predicts economic growth. By uncovering the underlying
structure of scientific development and connecting it with economic
development, our results may offer a new perspective to study national
scientific development and its relationships with economic development.
","[{'version': 'v1', 'created': 'Thu, 22 Apr 2021 01:06:03 GMT'}]",2021-04-23,"[['Miao', 'Lili', ''], ['Murray', 'Dakota', ''], ['Jung', 'Woo-Sung', ''], ['Larivière', 'Vincent', ''], ['Sugimoto', 'Cassidy R.', ''], ['Ahn', 'Yong-Yeol', '']]"
1910.11629,Danel Ahman,Danel Ahman and Andrej Bauer,Runners in action,ESOP 2020 final version + online appendix,,10.1007/978-3-030-44914-8_2,,cs.PL,http://creativecommons.org/licenses/by/4.0/,"  Runners of algebraic effects, also known as comodels, provide a mathematical
model of resource management. We show that they also give rise to a programming
concept that models top-level external resources, as well as allows programmers
to modularly define their own intermediate ""virtual machines"". We capture the
core ideas of programming with runners in an equational calculus
$\lambda_{\mathsf{coop}}$, which we equip with a sound and coherent
denotational semantics that guarantees the linear use of resources and
execution of finalisation code. We accompany $\lambda_{\mathsf{coop}}$ with
examples of runners in action, provide a prototype language implementation in
OCaml, as well as a Haskell library based on $\lambda_{\mathsf{coop}}$.
","[{'version': 'v1', 'created': 'Fri, 25 Oct 2019 11:37:35 GMT'}, {'version': 'v2', 'created': 'Sat, 18 Apr 2020 20:26:57 GMT'}]",2020-04-21,"[['Ahman', 'Danel', ''], ['Bauer', 'Andrej', '']]"
2112.14172,Spencer Bryngelson,Spencer H. Bryngelson and Rodney O. Fox and Tim Colonius,Conditional moment methods for polydisperse cavitating flows,"19 pages, 9 figures, submitted to J. Comp. Phys",,,,physics.flu-dyn physics.comp-ph,http://creativecommons.org/licenses/by/4.0/,"  The dynamics of cavitation bubbles are important in many flows, but their
small sizes and high number densities often preclude direct numerical
simulation. We present a computational model that averages their effect on the
flow over larger spatiotemporal scales. The model is based on solving a
generalized population balance equation (PBE) for nonlinear bubble dynamics and
explicitly represents the evolving probability density of bubble radii and
radial velocities. Conditional quadrature-based moment methods (QBMMs) are
adapted to solve this PBE. A one-way-coupled bubble dynamics problem
demonstrates the efficacy of different QBMMs for the evolving bubble
statistics. Results show that enforcing hyperbolicity during moment inversion
(CHyQMOM) provides comparable model-form accuracy to the traditional
conditional method of moments and decreases computational costs by about ten
times for a broad range of test cases. The CHyQMOM-based computational model is
implemented in MFC, an open-source multi-phase and high-order-accurate flow
solver. We assess the effect of the model and its parameters on a two-way
coupled bubble screen flow problem.
","[{'version': 'v1', 'created': 'Tue, 28 Dec 2021 14:59:24 GMT'}]",2021-12-30,"[['Bryngelson', 'Spencer H.', ''], ['Fox', 'Rodney O.', ''], ['Colonius', 'Tim', '']]"
1501.04051,Wengang Luo,"Wengang Luo, Yufei Cao, Pingan Hu, Kaiming Cai, Qi Feng, Faguang Yan,
  Tengfei Yan, Xinhui Zhang, and Kaiyou Wang","Gate Tuning of High-Performance InSe-Based Photodetectors Using Graphene
  Electrodes","27 pages, 10 figures in Advanced optical materials 2015",,,,physics.optics cond-mat.mes-hall,http://creativecommons.org/licenses/by/4.0/,"  In order to increase the response speed of the InSe-based photodetector with
high photoresponsivity, graphene is used as the transparent electrodes to
modify the difference of the work function between the electrodes and the InSe.
As expected, the response speed of InSe/graphene photodetectors is down to 120
{\mu}s, which is about 40 times faster than that of our InSe/metal device. And
it can also be tuned by the back-gate voltage from 310 {\mu}s down to 100
{\mu}s. With high response speed, the photoresponsivity can reach as high as 60
AW-1 simultaneously. Meanwhile the InSe/graphene photodetectors possess a broad
spectral range at 400-1000 nm. The design of 2D crystal/graphene electrical
contacts could be important for high performance optoelectronic devices.
","[{'version': 'v1', 'created': 'Fri, 16 Jan 2015 17:03:01 GMT'}, {'version': 'v2', 'created': 'Wed, 1 Jul 2015 01:14:17 GMT'}]",2015-07-02,"[['Luo', 'Wengang', ''], ['Cao', 'Yufei', ''], ['Hu', 'Pingan', ''], ['Cai', 'Kaiming', ''], ['Feng', 'Qi', ''], ['Yan', 'Faguang', ''], ['Yan', 'Tengfei', ''], ['Zhang', 'Xinhui', ''], ['Wang', 'Kaiyou', '']]"
2012.04837,Chaoqin Huang,"Fei Ye, Huangjie Zheng, Chaoqin Huang, Ya Zhang","Deep Unsupervised Image Anomaly Detection: An Information Theoretic
  Framework",,,,,cs.CV cs.LG stat.ML,http://creativecommons.org/licenses/by/4.0/,"  Surrogate task based methods have recently shown great promise for
unsupervised image anomaly detection. However, there is no guarantee that the
surrogate tasks share the consistent optimization direction with anomaly
detection. In this paper, we return to a direct objective function for anomaly
detection with information theory, which maximizes the distance between normal
and anomalous data in terms of the joint distribution of images and their
representation. Unfortunately, this objective function is not directly
optimizable under the unsupervised setting where no anomalous data is provided
during training. Through mathematical analysis of the above objective function,
we manage to decompose it into four components. In order to optimize in an
unsupervised fashion, we show that, under the assumption that distribution of
the normal and anomalous data are separable in the latent space, its lower
bound can be considered as a function which weights the trade-off between
mutual information and entropy. This objective function is able to explain why
the surrogate task based methods are effective for anomaly detection and
further point out the potential direction of improvement. Based on this object
function we introduce a novel information theoretic framework for unsupervised
image anomaly detection. Extensive experiments have demonstrated that the
proposed framework significantly outperforms several state-of-the-arts on
multiple benchmark data sets.
","[{'version': 'v1', 'created': 'Wed, 9 Dec 2020 03:07:00 GMT'}]",2020-12-10,"[['Ye', 'Fei', ''], ['Zheng', 'Huangjie', ''], ['Huang', 'Chaoqin', ''], ['Zhang', 'Ya', '']]"
2106.08562,Eduardo Pavez,"Eduardo Pavez, Andre L. Souto, Ricardo L. De Queiroz, Antonio Ortega",Multi-resolution intra-predictive coding of 3D point cloud attributes,"5 pages, 5 figures, Accepted at 2021 IEEE International Conference on
  Image Processing (ICIP)",,,,eess.IV cs.GR eess.SP,http://creativecommons.org/licenses/by/4.0/,"  We propose an intra frame predictive strategy for compression of 3D point
cloud attributes. Our approach is integrated with the region adaptive graph
Fourier transform (RAGFT), a multi-resolution transform formed by a composition
of localized block transforms, which produces a set of low pass (approximation)
and high pass (detail) coefficients at multiple resolutions. Since the
transform operations are spatially localized, RAGFT coefficients at a given
resolution may still be correlated. To exploit this phenomenon, we propose an
intra-prediction strategy, in which decoded approximation coefficients are used
to predict uncoded detail coefficients. The prediction residuals are then
quantized and entropy coded. For the 8i dataset, we obtain gains up to 0.5db as
compared to intra predicted point cloud compresion based on the region adaptive
Haar transform (RAHT).
","[{'version': 'v1', 'created': 'Wed, 16 Jun 2021 05:56:26 GMT'}]",2021-06-17,"[['Pavez', 'Eduardo', ''], ['Souto', 'Andre L.', ''], ['De Queiroz', 'Ricardo L.', ''], ['Ortega', 'Antonio', '']]"
2111.00341,Yuqin Yang,"Yuqin Yang, Mohamed Nafea, AmirEmad Ghassami, Negar Kiyavash","Causal Discovery in Linear Structural Causal Models with Deterministic
  Relations",,,,,cs.LG cs.AI cs.IT math.IT stat.ML,http://creativecommons.org/licenses/by/4.0/,"  Linear structural causal models (SCMs) -- in which each observed variable is
generated by a subset of the other observed variables as well as a subset of
the exogenous sources -- are pervasive in causal inference and casual
discovery. However, for the task of causal discovery, existing work almost
exclusively focus on the submodel where each observed variable is associated
with a distinct source with non-zero variance. This results in the restriction
that no observed variable can deterministically depend on other observed
variables or latent confounders. In this paper, we extend the results on
structure learning by focusing on a subclass of linear SCMs which do not have
this property, i.e., models in which observed variables can be causally
affected by any subset of the sources, and are allowed to be a deterministic
function of other observed variables or latent confounders. This allows for a
more realistic modeling of influence or information propagation in systems. We
focus on the task of causal discovery form observational data generated from a
member of this subclass. We derive a set of necessary and sufficient conditions
for unique identifiability of the causal structure. To the best of our
knowledge, this is the first work that gives identifiability results for causal
discovery under both latent confounding and deterministic relationships.
Further, we propose an algorithm for recovering the underlying causal structure
when the aforementioned conditions are satisfied. We validate our theoretical
results both on synthetic and real datasets.
","[{'version': 'v1', 'created': 'Sat, 30 Oct 2021 21:32:42 GMT'}]",2021-11-02,"[['Yang', 'Yuqin', ''], ['Nafea', 'Mohamed', ''], ['Ghassami', 'AmirEmad', ''], ['Kiyavash', 'Negar', '']]"
2108.08305,Hongkai Wen,"Lichuan Xiang, Royson Lee, Mohamed S. Abdelfattah, Nicholas D. Lane,
  Hongkai Wen",Temporal Kernel Consistency for Blind Video Super-Resolution,,,,,eess.IV cs.AI cs.CV cs.LG,http://creativecommons.org/licenses/by/4.0/,"  Deep learning-based blind super-resolution (SR) methods have recently
achieved unprecedented performance in upscaling frames with unknown
degradation. These models are able to accurately estimate the unknown
downscaling kernel from a given low-resolution (LR) image in order to leverage
the kernel during restoration. Although these approaches have largely been
successful, they are predominantly image-based and therefore do not exploit the
temporal properties of the kernels across multiple video frames. In this paper,
we investigated the temporal properties of the kernels and highlighted its
importance in the task of blind video super-resolution. Specifically, we
measured the kernel temporal consistency of real-world videos and illustrated
how the estimated kernels might change per frame in videos of varying
dynamicity of the scene and its objects. With this new insight, we revisited
previous popular video SR approaches, and showed that previous assumptions of
using a fixed kernel throughout the restoration process can lead to visual
artifacts when upscaling real-world videos. In order to counteract this, we
tailored existing single-image and video SR techniques to leverage kernel
consistency during both kernel estimation and video upscaling processes.
Extensive experiments on synthetic and real-world videos show substantial
restoration gains quantitatively and qualitatively, achieving the new
state-of-the-art in blind video SR and underlining the potential of exploiting
kernel temporal consistency.
","[{'version': 'v1', 'created': 'Wed, 18 Aug 2021 13:09:38 GMT'}]",2021-08-20,"[['Xiang', 'Lichuan', ''], ['Lee', 'Royson', ''], ['Abdelfattah', 'Mohamed S.', ''], ['Lane', 'Nicholas D.', ''], ['Wen', 'Hongkai', '']]"
2104.14714,El Hadji Deme,"El Hadji Mamadou Sall, El Hadji Deme and Abdou K\^a Diongue",Adaptive Realized Hyperbolic GARCH Process: Stability and Estimation,,,,,stat.ME,http://creativecommons.org/licenses/by/4.0/,"  In this paper, we propose an Adaptive Realized Hyperbolic GARCH (A-Realized
HYGARCH) process to model the long memory of high-frequency time series with
possible structural breaks. The structural change is modeled by allowing the
intercept to follow the smooth and flexible function form introduced by Gallant
(1984). In addition, stability conditions of the process are investigated. A
Monte Carlo study is investigated in order to illustrate the performance of the
A-Realized HYGARCH process compared to the Realized HYGARCH with or without
structural change.
","[{'version': 'v1', 'created': 'Fri, 30 Apr 2021 01:30:53 GMT'}]",2021-05-03,"[['Sall', 'El Hadji Mamadou', ''], ['Deme', 'El Hadji', ''], ['Diongue', 'Abdou Kâ', '']]"
2110.14732,Haider Zia Dr.,Haider Zia,"Maintaining Constant Pulse-duration in Highly Dispersive Media using
  Nonlinear Potentials",,,,,physics.optics,http://creativecommons.org/licenses/by/4.0/,"  A method is shown for preventing temporal broadening of ultrafast optical
pulses in highly dispersive and fluctuating media for arbitrary signal-pulse
profiles. Pulse pairs, consisting of a strong-field control-pulse and a
weak-field signal-pulse co-propagate, whereby the specific profile of the
strong-field pulse precisely compensates for dispersive phase in the weak
pulse. A numerical example is presented in an optical system consisting of both
resonant and gain dispersive effects. Here we show signal-pulses that do not
temporally broaden across a vast propagation distance, even in the presence of
dispersion that fluctuates several orders of magnitude and in sign (for example
within a material resonance) across the pulse's bandwidth. Our approach
illustrates the potential for using cross-phase modulation to compensate for
dispersive effects on a signal-pulse and fills the gap in the current
understanding of this nonlinear phenomenon.
","[{'version': 'v1', 'created': 'Wed, 27 Oct 2021 19:36:35 GMT'}, {'version': 'v2', 'created': 'Mon, 15 Nov 2021 22:53:59 GMT'}]",2021-11-17,"[['Zia', 'Haider', '']]"
