id,submitter,authors,title,comments,journal-ref,doi,report-no,categories,license,abstract,versions,update_date,authors_parsed
2111.03399,Sam Geen,"Sam Geen, Alex de Koter","Bottling the Champagne: Dynamics and Radiation Trapping of Wind-Driven
  Bubbles around Massive Stars","17 pages, 10 figures, published in MNRAS","Monthly Notices of the Royal Astronomical Society, Volume 509,
  Issue 3, January 2022, Pages 4498-4514",10.1093/mnras/stab3245,,astro-ph.GA,http://creativecommons.org/licenses/by/4.0/,"  In this paper we make predictions for the behaviour of wind bubbles around
young massive stars using analytic theory. We do this in order to determine why
there is a discrepancy between theoretical models that predict that winds
should play a secondary role to photoionisation in the dynamics of HII regions,
and observations of young HII regions that seem to suggest a driving role for
winds. In particular, regions such as M42 in Orion have neutral hydrogen
shells, suggesting that the ionising radiation is trapped closer to the star.
We first derive formulae for wind bubble evolution in non-uniform density
fields, focusing on singular isothermal sphere density fields with a power law
index of -2. We find that a classical ""Weaver""-like expansion velocity becomes
constant in such a density distribution. We then calculate the structure of the
photoionised shell around such wind bubbles, and determine at what point the
mass in the shell cannot absorb all of the ionising photons emitted by the
star, causing an ""overflow"" of ionising radiation. We also estimate
perturbations from cooling, gravity, magnetic fields and instabilities, all of
which we argue are secondary effects for the conditions studied here. Our
wind-driven model provides a consistent explanation for the behaviour of M42 to
within the errors given by observational studies. We find that in relatively
denser molecular cloud environments \around single young stellar sources,
champagne flows are unlikely until the wind shell breaks up due to turbulence
or clumping in the cloud.
","[{'version': 'v1', 'created': 'Fri, 5 Nov 2021 11:21:52 GMT'}, {'version': 'v2', 'created': 'Wed, 22 Dec 2021 16:23:22 GMT'}]",2021-12-23,"[['Geen', 'Sam', ''], ['de Koter', 'Alex', '']]"
2102.07144,Anastasios Papazafeiropoulos,"Anastasios K. Papazafeiropoulos, Pandelis Kourtessis, Symeon
  Chatzinotas, John M. Senior",Multipair Two-Way DF Relaying with Cell-Free Massive MIMO,"15 pages, 8 figures, This work was accepted in IEEE Trans. Green
  Commun. Net. Copyright may be transferred without notice, after which this
  version may no longer be accessible",,,,cs.IT math.IT,http://creativecommons.org/licenses/by/4.0/,"  We consider a two-way half-duplex decode-and-forward (DF) relaying system
with multiple pairs of single-antenna users assisted by a cell-free (CF)
massive multiple-input multiple-output (mMIMO) architecture with
multiple-antenna access points (APs). Under the practical constraint of
imperfect channel state information (CSI), we derive the achievable sum
spectral efficiency (SE) for a finite number of APs with maximum ratio (MR)
linear processing for both reception and transmission in closed-form. Notably,
the proposed CF mMIMO relaying architecture, exploiting the spatial diversity,
and providing better coverage, outperforms the conventional collocated mMIMO
deployment. Moreover, we shed light on the power-scaling laws maintaining a
specific SE as the number of APs grows. A thorough examination of the interplay
between the transmit powers per pilot symbol and user/APs takes place, and
useful conclusions are extracted. Finally, differently to the common approach
for power control in CF mMIMO systems, we design a power allocation scheme
maximizing the sum SE.
","[{'version': 'v1', 'created': 'Sun, 14 Feb 2021 12:57:05 GMT'}]",2021-02-16,"[['Papazafeiropoulos', 'Anastasios K.', ''], ['Kourtessis', 'Pandelis', ''], ['Chatzinotas', 'Symeon', ''], ['Senior', 'John M.', '']]"
2010.02140,Jan Deriu,"Jan Deriu and Don Tuggener and Pius von D\""aniken and Jon Ander Campos
  and Alvaro Rodrigo and Thiziri Belkacem and Aitor Soroa and Eneko Agirre and
  Mark Cieliebak","Spot The Bot: A Robust and Efficient Framework for the Evaluation of
  Conversational Dialogue Systems",,,,,cs.AI cs.CL,http://creativecommons.org/licenses/by/4.0/,"  The lack of time-efficient and reliable evaluation methods hamper the
development of conversational dialogue systems (chatbots). Evaluations
requiring humans to converse with chatbots are time and cost-intensive, put
high cognitive demands on the human judges, and yield low-quality results. In
this work, we introduce \emph{Spot The Bot}, a cost-efficient and robust
evaluation framework that replaces human-bot conversations with conversations
between bots. Human judges then only annotate for each entity in a conversation
whether they think it is human or not (assuming there are humans participants
in these conversations). These annotations then allow us to rank chatbots
regarding their ability to mimic the conversational behavior of humans. Since
we expect that all bots are eventually recognized as such, we incorporate a
metric that measures which chatbot can uphold human-like behavior the longest,
i.e., \emph{Survival Analysis}. This metric has the ability to correlate a
bot's performance to certain of its characteristics (e.g., \ fluency or
sensibleness), yielding interpretable results. The comparably low cost of our
framework allows for frequent evaluations of chatbots during their evaluation
cycle. We empirically validate our claims by applying \emph{Spot The Bot} to
three domains, evaluating several state-of-the-art chatbots, and drawing
comparisons to related work. The framework is released as a ready-to-use tool.
","[{'version': 'v1', 'created': 'Mon, 5 Oct 2020 16:37:52 GMT'}]",2020-10-06,"[['Deriu', 'Jan', ''], ['Tuggener', 'Don', ''], ['von Däniken', 'Pius', ''], ['Campos', 'Jon Ander', ''], ['Rodrigo', 'Alvaro', ''], ['Belkacem', 'Thiziri', ''], ['Soroa', 'Aitor', ''], ['Agirre', 'Eneko', ''], ['Cieliebak', 'Mark', '']]"
2106.16060,Emanuele Sansone,Emanuele Sansone,Leveraging Hidden Structure in Self-Supervised Learning,,,,,cs.LG cs.CV,http://creativecommons.org/licenses/by/4.0/,"  This work considers the problem of learning structured representations from
raw images using self-supervised learning. We propose a principled framework
based on a mutual information objective, which integrates self-supervised and
structure learning. Furthermore, we devise a post-hoc procedure to interpret
the meaning of the learnt representations. Preliminary experiments on CIFAR-10
show that the proposed framework achieves higher generalization performance in
downstream classification tasks and provides more interpretable representations
compared to the ones learnt through traditional self-supervised learning.
","[{'version': 'v1', 'created': 'Wed, 30 Jun 2021 13:35:36 GMT'}]",2021-07-01,"[['Sansone', 'Emanuele', '']]"
2111.02110,Luis Fernando D'Haro,"Chen Zhang and Jo\~ao Sedoc and Luis Fernando D'Haro and Rafael Banchs
  and Alexander Rudnicky",Automatic Evaluation and Moderation of Open-domain Dialogue Systems,,,,,cs.CL cs.HC,http://creativecommons.org/licenses/by/4.0/,"  The development of Open-Domain Dialogue Systems (ODS)is a trending topic due
to the large number of research challenges, large societal and business impact,
and advances in the underlying technology. However, the development of these
kinds of systems requires two important characteristics:1) automatic evaluation
mechanisms that show high correlations with human judgements across multiple
dialogue evaluation aspects (with explainable features for providing
constructive and explicit feedback on the quality of generative models'
responses for quick development and deployment)and 2) mechanisms that can help
to control chatbot responses,while avoiding toxicity and employing intelligent
ways to handle toxic user comments and keeping interaction flow and engagement.
This track at the 10th Dialogue System Technology Challenge (DSTC10) is part of
the ongoing effort to promote scalable and toxic-free ODS. This paper describes
the datasets and baselines provided to participants, as well as submission
evaluation results for each of the two proposed subtasks.
","[{'version': 'v1', 'created': 'Wed, 3 Nov 2021 10:08:05 GMT'}, {'version': 'v2', 'created': 'Sat, 20 Nov 2021 20:20:19 GMT'}, {'version': 'v3', 'created': 'Thu, 23 Dec 2021 22:35:06 GMT'}]",2021-12-28,"[['Zhang', 'Chen', ''], ['Sedoc', 'João', ''], [""D'Haro"", 'Luis Fernando', ''], ['Banchs', 'Rafael', ''], ['Rudnicky', 'Alexander', '']]"
2112.07772,Sara Rosenthal,"Sara Rosenthal, Mihaela Bornea, Avirup Sil, Radu Florian, Scott
  McCarley",Do Answers to Boolean Questions Need Explanations? Yes,9 pages,,,,cs.CL,http://creativecommons.org/licenses/by/4.0/,"  Existing datasets that contain boolean questions, such as BoolQ and TYDI QA ,
provide the user with a YES/NO response to the question. However, a one word
response is not sufficient for an explainable system. We promote explainability
by releasing a new set of annotations marking the evidence in existing TyDi QA
and BoolQ datasets. We show that our annotations can be used to train a model
that extracts improved evidence spans compared to models that rely on existing
resources. We confirm our findings with a user study which shows that our
extracted evidence spans enhance the user experience. We also provide further
insight into the challenges of answering boolean questions, such as passages
containing conflicting YES and NO answers, and varying degrees of relevance of
the predicted evidence.
","[{'version': 'v1', 'created': 'Tue, 14 Dec 2021 22:40:28 GMT'}]",2021-12-16,"[['Rosenthal', 'Sara', ''], ['Bornea', 'Mihaela', ''], ['Sil', 'Avirup', ''], ['Florian', 'Radu', ''], ['McCarley', 'Scott', '']]"
2111.11628,Thomas Claudet,"Thomas Claudet, Ryan Alimo, Edwin Goh, Mark Johnston, Ramtin Madani,
  Brian Wilson","$\Delta$-MILP: Deep Space Network Scheduling via Mixed-Integer Linear
  Programming","21 pages, 12 figures, 4 tables, 2 algorithms",,,,math.OC cs.SY eess.SY,http://creativecommons.org/licenses/by/4.0/,"  This paper introduces $\Delta$-MILP, a powerful variant of the mixed-integer
linear programming (MILP) optimization framework to solve NASA's Deep Space
Network (DSN) scheduling problem. This work is an extension of our original
MILP framework (DOI:10.1109/ACCESS.2021.3064928) and inherits many of its
constructions and strengths, including the base MILP formulation for DSN
scheduling. To provide more feasible schedules with respect to the DSN
requirements, $\Delta$-MILP incorporates new sets of constraints including 1)
splitting larger tracks into shorter segments and 2) preventing overlapping
between tracks on different antennas. Additionally, $\Delta$-MILP leverages a
heuristic to balance mission satisfaction and allows to prioritize certain
missions in special scenarios including emergencies and landings. Numerical
validations demonstrate that $\Delta$-MILP now satisfies 100% of the requested
constraints and provides fair schedules amongst missions with respect to the
state-of-the-art for the most oversubscribed weeks of the years 2016 and 2018.
","[{'version': 'v1', 'created': 'Tue, 23 Nov 2021 03:20:15 GMT'}, {'version': 'v2', 'created': 'Mon, 14 Feb 2022 18:12:38 GMT'}]",2022-02-15,"[['Claudet', 'Thomas', ''], ['Alimo', 'Ryan', ''], ['Goh', 'Edwin', ''], ['Johnston', 'Mark', ''], ['Madani', 'Ramtin', ''], ['Wilson', 'Brian', '']]"
2112.11777,Alexandra Blenkinsop,"Susan D. Hillis, Alexandra Blenkinsop, Andr\'es Villaveces, Francis B.
  Annor, Leandris Liburd, Greta M. Massetti, Zewditu Demissie, James A. Mercy,
  Charles A. Nelson III, Lucie Cluver, Seth Flaxman, Lorraine Sherr, Christl A.
  Donnelly, Oliver Ratmann, H. Juliette T. Unwin",COVID-19-Associated Orphanhood and Caregiver Death in the United States,,,10.1542/peds.2021-053760,,stat.AP,http://creativecommons.org/licenses/by/4.0/,"  Background: Most COVID-19 deaths occur among adults, not children, and
attention has focused on mitigating COVID-19 burden among adults. However, a
tragic consequence of adult deaths is that high numbers of children might lose
their parents and caregivers to COVID-19-associated deaths.
  Methods: We quantified COVID-19-associated caregiver loss and orphanhood in
the US and for each state using fertility and excess and COVID-19 mortality
data. We assessed burden and rates of COVID-19-associated orphanhood and deaths
of custodial and co-residing grandparents, overall and by race/ethnicity. We
further examined variations in COVID-19-associated orphanhood by race/ethnicity
for each state.
  Results: We found that from April 1, 2020 through June 30, 2021, over 140,000
children in the US experienced the death of a parent or grandparent caregiver.
The risk of such loss was 1.1 to 4.5 times higher among children of racial and
ethnic minorities, compared to Non-Hispanic White children. The highest burden
of COVID-19-associated death of parents and caregivers occurred in Southern
border states for Hispanic children, Southeastern states for Black children,
and in states with tribal areas for American Indian/Alaska Native populations.
  Conclusions: We found substantial disparities in distributions of
COVID-19-associated death of parents and caregivers across racial and ethnic
groups. Children losing caregivers to COVID-19 need care and safe, stable, and
nurturing families with economic support, quality childcare and evidence-based
parenting support programs. There is an urgent need to mount an evidence-based
comprehensive response focused on those children at greatest risk, in the
states most affected.
","[{'version': 'v1', 'created': 'Wed, 22 Dec 2021 10:29:51 GMT'}]",2021-12-23,"[['Hillis', 'Susan D.', ''], ['Blenkinsop', 'Alexandra', ''], ['Villaveces', 'Andrés', ''], ['Annor', 'Francis B.', ''], ['Liburd', 'Leandris', ''], ['Massetti', 'Greta M.', ''], ['Demissie', 'Zewditu', ''], ['Mercy', 'James A.', ''], ['Nelson', 'Charles A.', 'III'], ['Cluver', 'Lucie', ''], ['Flaxman', 'Seth', ''], ['Sherr', 'Lorraine', ''], ['Donnelly', 'Christl A.', ''], ['Ratmann', 'Oliver', ''], ['Unwin', 'H. Juliette T.', '']]"
2106.04082,Satoru Odake,Satoru Odake and Ryu Sasaki,Markov Chains Generated by Convolutions of Orthogonality Measures,"48 pages. The underlying logic of the main Theorem 2.1 is clarified
  and an Appendix is added. Examples related to the little $q$-Jacobi
  polynomial are added",,,DPSU-21-1,math.PR math-ph math.CA math.MP math.ST nlin.SI stat.TH,http://creativecommons.org/licenses/by/4.0/,"  About two dozens of exactly solvable Markov chains on one-dimensional finite
and semi-infinite integer lattices are constructed in terms of convolutions of
orthogonality measures of the Krawtchouk, Hahn, Meixner, Charlier, $q$-Hahn,
$q$-Meixner and little $q$-Jacobi polynomials. By construction, the stationary
probability distributions, the complete sets of eigenvalues and eigenvectors
are provided by the polynomials and the orthogonality measures. An interesting
property possessed by these stationary probability distributions, called
`convolutional self-similarity,' is demonstrated.
","[{'version': 'v1', 'created': 'Tue, 8 Jun 2021 03:39:28 GMT'}, {'version': 'v2', 'created': 'Fri, 22 Oct 2021 02:33:37 GMT'}]",2021-10-25,"[['Odake', 'Satoru', ''], ['Sasaki', 'Ryu', '']]"
2102.05915,Shaolin Ji,Qiang Han and Shaolin Ji,"Novel multi-step predictor-corrector schemes for backward stochastic
  differential equations",,,,,math.NA cs.NA,http://creativecommons.org/licenses/by/4.0/,"  Novel multi-step predictor-corrector numerical schemes have been derived for
approximating decoupled forward-backward stochastic differential equations
(FBSDEs). The stability and high order rate of convergence of the schemes are
rigorously proved. We also present a sufficient and necessary condition for the
stability of the schemes. Numerical experiments are given to illustrate the
stability and convergence rates of the proposed methods.
","[{'version': 'v1', 'created': 'Thu, 11 Feb 2021 10:02:09 GMT'}]",2021-02-12,"[['Han', 'Qiang', ''], ['Ji', 'Shaolin', '']]"
2110.12541,AmirEmad Ghassami,"AmirEmad Ghassami, Ilya Shpitser",Partially Intervenable Causal Models,"The authors received communication that convincingly argued this
  draft in its current state does not engage sufficiently with prior work on
  partially intervenable causal models. Thus, it is not yet ready to be
  publicly shown in its current state",,,,stat.ME cs.AI math.ST stat.TH,http://creativecommons.org/licenses/by/4.0/,"  Graphical causal models led to the development of complete non-parametric
identification theory in arbitrary structured systems, and general approaches
to efficient inference. Nevertheless, graphical approaches to causal inference
have not been embraced by the statistics and public health communities. In
those communities causal assumptions are instead expressed in terms of
potential outcomes, or responses to hypothetical interventions. Such
interventions are generally conceptualized only on a limited set of variables,
where the corresponding experiment could, in principle, be performed. By
contrast, graphical approaches to causal inference generally assume
interventions on all variables are well defined - an overly restrictive and
unrealistic assumption that may have limited the adoption of these approaches
in applied work in statistics and public health. In this paper, we build on a
unification of graphical and potential outcomes approaches to causality
exemplified by Single World Intervention Graphs (SWIGs) to define graphical
models with a restricted set of allowed interventions. We give a complete
identification theory for such models, and develop a complete calculus of
interventions based on a generalization of the do-calculus, and axioms that
govern probabilistic operations on Markov kernels. A corollary of our results
is a complete identification theory for causal effects in another graphical
framework with a restricted set of interventions, the decision theoretic
graphical formulation of causality.
","[{'version': 'v1', 'created': 'Sun, 24 Oct 2021 22:24:57 GMT'}, {'version': 'v2', 'created': 'Sun, 31 Oct 2021 01:31:26 GMT'}]",2021-11-02,"[['Ghassami', 'AmirEmad', ''], ['Shpitser', 'Ilya', '']]"
2108.06161,Yu'an Chen,"Yu'an Chen, Ruosong Ye, Ziyang Tao, Hongjian Liu, Guangda Chen, Jie
  Peng, Jun Ma, Yu Zhang, Yanyong Zhang and Jianmin Ji","Reinforcement Learning for Robot Navigation with Adaptive
  ExecutionDuration (AED) in a Semi-Markov Model","There are errors in the paper. Mainly in the introduction, the
  proposition of how execution duration infulence the navigation performance is
  prejudiced. Therefore, we need to fix this section totally",,,,cs.RO cs.AI,http://creativecommons.org/licenses/by/4.0/,"  Deep reinforcement learning (DRL) algorithms have proven effective in robot
navigation, especially in unknown environments, through directly mapping
perception inputs into robot control commands. Most existing methods adopt
uniform execution duration with robots taking commands at fixed intervals. As
such, the length of execution duration becomes a crucial parameter to the
navigation algorithm. In particular, if the duration is too short, then the
navigation policy would be executed at a high frequency, with increased
training difficulty and high computational cost. Meanwhile, if the duration is
too long, then the policy becomes unable to handle complex situations, like
those with crowded obstacles. It is thus tricky to find the ""sweet"" duration
range; some duration values may render a DRL model to fail to find a navigation
path. In this paper, we propose to employ adaptive execution duration to
overcome this problem. Specifically, we formulate the navigation task as a
Semi-Markov Decision Process (SMDP) problem to handle adaptive execution
duration. We also improve the distributed proximal policy optimization (DPPO)
algorithm and provide its theoretical guarantee for the specified SMDP problem.
We evaluate our approach both in the simulator and on an actual robot. The
results show that our approach outperforms the other DRL-based method (with
fixed execution duration) by 10.3% in terms of the navigation success rate.
","[{'version': 'v1', 'created': 'Fri, 13 Aug 2021 10:30:25 GMT'}, {'version': 'v2', 'created': 'Mon, 30 Aug 2021 07:44:05 GMT'}]",2021-08-31,"[['Chen', ""Yu'an"", ''], ['Ye', 'Ruosong', ''], ['Tao', 'Ziyang', ''], ['Liu', 'Hongjian', ''], ['Chen', 'Guangda', ''], ['Peng', 'Jie', ''], ['Ma', 'Jun', ''], ['Zhang', 'Yu', ''], ['Zhang', 'Yanyong', ''], ['Ji', 'Jianmin', '']]"
2107.04749,Mohammad Nayeem Teli,Mohammad Nayeem Teli and Seungwon Oh,"Resilience of Autonomous Vehicle Object Category Detection to Universal
  Adversarial Perturbations",,"2021 IEEE International IOT, Electronics and Mechatronics
  Conference (IEMTRONICS), 2021, pp. 1-6",10.1109/IEMTRONICS52119.2021.9422616,,cs.CV,http://creativecommons.org/licenses/by/4.0/,"  Due to the vulnerability of deep neural networks to adversarial examples,
numerous works on adversarial attacks and defenses have been burgeoning over
the past several years. However, there seem to be some conventional views
regarding adversarial attacks and object detection approaches that most
researchers take for granted. In this work, we bring a fresh perspective on
those procedures by evaluating the impact of universal perturbations on object
detection at a class-level. We apply it to a carefully curated data set related
to autonomous driving. We use Faster-RCNN object detector on images of five
different categories: person, car, truck, stop sign and traffic light from the
COCO data set, while carefully perturbing the images using Universal Dense
Object Suppression algorithm. Our results indicate that person, car, traffic
light, truck and stop sign are resilient in that order (most to least) to
universal perturbations. To the best of our knowledge, this is the first time
such a ranking has been established which is significant for the security of
the data sets pertaining to autonomous vehicles and object detection in
general.
","[{'version': 'v1', 'created': 'Sat, 10 Jul 2021 03:40:25 GMT'}]",2021-07-13,"[['Teli', 'Mohammad Nayeem', ''], ['Oh', 'Seungwon', '']]"
2203.07385,Jenna Samuel,"Jenna Samuel, Andrew Wetzel, Isaiah Santistevan, Erik Tollerud, Jorge
  Moreno, Michael Boylan-Kolchin, Jeremy Bailin, Bhavya Pardasani","Extinguishing the FIRE: environmental quenching of satellite galaxies
  around Milky Way-mass hosts in simulations","16 pages, 12 figures, + appendices. Submitted to MNRAS",,,,astro-ph.GA,http://creativecommons.org/licenses/by/4.0/,"  The star formation and gas content of satellite galaxies around the Milky Way
(MW) and Andromeda (M31) are depleted relative to more isolated galaxies in the
Local Group (LG) at fixed stellar mass. We explore the environmental regulation
of gas content and quenching of star formation in $z=0$ galaxies at
$M_{*}=10^{5-10}$ $\rm{M}_{\odot}$ around 14 MW-mass hosts from the FIRE-2
simulations. Lower-mass satellites ($M_{*}\lesssim10^7$ $\rm{M}_{\odot}$) are
mostly quiescent and higher-mass satellites ($M_{*}\gtrsim10^8$
$\rm{M}_{\odot}$) are mostly star-forming, with intermediate-mass satellites
($M_{*}\approx10^{7-8}$ $\rm{M}_{\odot}$) split roughly equally between
quiescent and star-forming. Hosts with more gas in their circumgalactic medium
have a higher quiescent fraction of massive satellites ($M_{*}=10^{8-9}$
$\rm{M}_{\odot}$). We find no significant dependence on isolated versus paired
(LG-like) host environments, and the quiescent fractions of satellites around
MW-mass and LMC-mass hosts from the FIRE-2 simulations are remarkably similar.
Environmental effects that lead to quenching can also occur as preprocessing in
low-mass groups prior to MW infall. Lower-mass satellites typically quenched
before MW infall as central galaxies or rapidly during infall into a low-mass
group or a MW-mass galaxy. Intermediate- to high-mass satellites usually
require $\geq1-2$ pericentre passages ($\approx2.5-5$ Gyr) within a MW-mass
halo to quench. Most galaxies with $M_{*}\gtrsim10^{6.5}$ $\rm{M}_{\odot}$ did
not quench before falling into a host, indicating a possible upper mass limit
for isolated quenching. The simulations are broadly consistent with the
quiescent fractions of satellites observed in the LG and the SAGA survey,
because the simulation average lies between them and the host-to-host scatter
is large.
","[{'version': 'v1', 'created': 'Mon, 14 Mar 2022 18:00:01 GMT'}]",2022-03-16,"[['Samuel', 'Jenna', ''], ['Wetzel', 'Andrew', ''], ['Santistevan', 'Isaiah', ''], ['Tollerud', 'Erik', ''], ['Moreno', 'Jorge', ''], ['Boylan-Kolchin', 'Michael', ''], ['Bailin', 'Jeremy', ''], ['Pardasani', 'Bhavya', '']]"
